{
  "schema_version": "0.2.1",
  "source_profile": "space-idle-strategy-2d",
  "style_keywords": [
    "space",
    "strategic",
    "clean silhouette",
    "data-rich UI"
  ],
  "palette": "deep-space neutrals with faction accent colors",
  "shape_language": "recognizable ships and orbital forms",
  "consistency_rules": [
    "preserve scale labels in metadata",
    "keep UI contrast above background contrast"
  ]
}
