{
  "schema_version": "0.2.1",
  "source_profile": "topdown-rpg-mmorpg-2d",
  "style_keywords": [
    "top-down",
    "adventurous",
    "readable combat",
    "modular environment"
  ],
  "palette": "faction-aware palette with gameplay contrast",
  "shape_language": "clear silhouettes and directional facing",
  "consistency_rules": [
    "share tile scale across characters and environment",
    "reserve contrast for interactable/combat states"
  ]
}
