{
  "schema_version": "0.2",
  "source_profile": "stylized-3d",
  "style_keywords": [
    "stylized",
    "clean planes",
    "readable proportions"
  ],
  "palette": "limited material palette with accent colors",
  "shape_language": "exaggerated silhouettes and intentional bevels",
  "consistency_rules": [
    "use a common unit scale",
    "keep material roughness families consistent"
  ]
}
